{
  "$schema": "https://json-schema.org/draft/2020-12/schema",
  "$id": "https://venho.local/contracts/face_observability_v1/1.0",
  "title": "Face Observability V1",
  "description": "Measured face observability evidence used for Candidate v3 routing.",
  "type": "object",
  "additionalProperties": false,
  "required": [
    "schemaVersion",
    "imageSha256",
    "imageWidth",
    "imageHeight",
    "maskSha256",
    "maskWidth",
    "maskHeight",
    "detectorId",
    "detectorVersion",
    "detectorConfigSha256",
    "faceCount",
    "bbox",
    "landmarks",
    "detectedFaces",
    "bboxWidthPx",
    "bboxHeightPx",
    "selectedFaceIndex",
    "selectedFaceConfidence",
    "faceCenter",
    "borderClipped",
    "faceBboxIntersectsEditableMask",
    "faceBboxMaskOverlapAreaPx",
    "faceBboxMaskOverlapRatio",
    "editableMaskNonzeroPixelCount",
    "editableMaskCoverageRatio",
    "faceCenterInsideEditableMask",
    "status",
    "qualityTier",
    "failureReasons",
    "measurementConfigSha256",
    "measurementSha256"
  ],
  "properties": {
    "schemaVersion": { "const": "1.0" },
    "imageSha256": { "$ref": "#/$defs/Sha256" },
    "imageWidth": { "type": "integer", "minimum": 0 },
    "imageHeight": { "type": "integer", "minimum": 0 },
    "maskSha256": { "type": "string", "pattern": "^(|[a-f0-9]{64})$" },
    "maskWidth": { "type": "integer", "minimum": 0 },
    "maskHeight": { "type": "integer", "minimum": 0 },
    "detectorId": { "type": "string", "minLength": 1 },
    "detectorVersion": { "type": "string", "minLength": 1 },
    "detectorConfigSha256": { "$ref": "#/$defs/Sha256" },
    "faceCount": { "type": "integer", "minimum": 0 },
    "selectedFaceIndex": { "type": ["integer", "null"], "minimum": 0 },
    "selectedFaceConfidence": { "type": ["number", "null"], "minimum": 0, "maximum": 1 },
    "bbox": { "anyOf": [{ "$ref": "#/$defs/BoundingBox" }, { "type": "null" }] },
    "landmarks": { "type": "array", "items": { "$ref": "#/$defs/Landmark" } },
    "detectedFaces": { "type": "array", "items": { "$ref": "#/$defs/DetectedFace" } },
    "bboxWidthPx": { "type": ["number", "null"], "minimum": 0 },
    "bboxHeightPx": { "type": ["number", "null"], "minimum": 0 },
    "interocularDistancePx": { "type": ["number", "null"], "minimum": 0 },
    "faceCenter": { "anyOf": [{ "$ref": "#/$defs/FaceCenter" }, { "type": "null" }] },
    "yawDeg": { "type": ["number", "null"] },
    "pitchDeg": { "type": ["number", "null"] },
    "rollDeg": { "type": ["number", "null"] },
    "borderClipped": { "type": ["boolean", "null"] },
    "faceBboxIntersectsEditableMask": { "type": ["boolean", "null"] },
    "faceBboxMaskOverlapAreaPx": { "type": ["integer", "null"], "minimum": 0 },
    "faceBboxMaskOverlapRatio": { "type": ["number", "null"], "minimum": 0 },
    "editableMaskNonzeroPixelCount": { "type": ["integer", "null"], "minimum": 0 },
    "editableMaskCoverageRatio": { "type": ["number", "null"], "minimum": 0, "maximum": 1 },
    "faceCenterInsideEditableMask": { "type": ["boolean", "null"] },
    "status": { "enum": ["VALID", "INVALID", "AMBIGUOUS"] },
    "qualityTier": {
      "enum": ["HIGH", "LIMITED", "UNRECOVERABLE"]
    },
    "failureReasons": { "type": "array", "items": { "type": "string", "minLength": 1 } },
    "measurementConfigSha256": { "$ref": "#/$defs/Sha256" },
    "measurementSha256": { "$ref": "#/$defs/Sha256" }
  },
  "$defs": {
    "Sha256": {
      "type": "string",
      "pattern": "^[a-f0-9]{64}$"
    },
    "NormalizedScore": {
      "type": "number",
      "minimum": 0,
      "maximum": 1
    },
    "BoundingBox": {
      "type": "object",
      "additionalProperties": false,
      "required": ["left", "top", "right", "bottom"],
      "properties": {
        "left": { "type": "number", "minimum": 0 },
        "top": { "type": "number", "minimum": 0 },
        "right": { "type": "number", "minimum": 0 },
        "bottom": { "type": "number", "minimum": 0 }
      }
    },
    "RestorationRouteDecision": {
      "type": "object",
      "additionalProperties": false,
      "required": ["code", "reasons"],
      "properties": {
        "code": {
          "enum": [
            "ELIGIBLE",
            "REVIEW_REQUIRED",
            "BASE_REGEN_REQUIRED",
            "REJECTED_INVALID_INPUT"
          ]
        },
        "reasons": {
          "type": "array",
          "items": { "type": "string", "minLength": 1 }
        }
      }
    },
    "Landmark": {
      "type": "object",
      "additionalProperties": false,
      "required": ["x", "y"],
      "properties": {
        "x": { "type": "number" },
        "y": { "type": "number" }
      }
    },
    "FaceCenter": {
      "type": "object",
      "additionalProperties": false,
      "required": ["x", "y"],
      "properties": {
        "x": { "type": "number" },
        "y": { "type": "number" }
      }
    },
    "DetectedFace": {
      "type": "object",
      "additionalProperties": false,
      "required": ["confidence", "bbox", "landmarks", "yawDeg", "pitchDeg", "rollDeg"],
      "properties": {
        "confidence": { "type": "number", "minimum": 0, "maximum": 1 },
        "bbox": { "$ref": "#/$defs/BoundingBox" },
        "landmarks": { "type": "array", "items": { "$ref": "#/$defs/Landmark" } },
        "yawDeg": { "type": ["number", "null"] },
        "pitchDeg": { "type": ["number", "null"] },
        "rollDeg": { "type": ["number", "null"] }
      }
    }
  }
}
