{"bbox":{"bottom":618.5683441162109,"left":510.1838684082031,"right":553.1896781921387,"top":542.784912109375},"bboxHeightPx":75.78343200683594,"bboxWidthPx":43.00580978393555,"borderClipped":false,"detectedFaces":[{"bbox":{"bottom":618.5683441162109,"left":510.1838684082031,"right":553.1896781921387,"top":542.784912109375},"confidence":0.85426926612854,"landmarks":[{"x":517.3872680664062,"y":571.6520385742188},{"x":523.2520141601562,"y":572.5156860351562},{"x":512.272705078125,"y":585.1289672851562},{"x":519.70458984375,"y":598.2861938476562},{"x":523.7939453125,"y":599.8984985351562}],"pitchDeg":-141.7041979219793,"rollDeg":27.606772256570125,"yawDeg":79.361664677042}],"detectorConfigSha256":"dd68ea40868c45e75db97f53e05defb53c5a6fe387fe9cfac79a234fc4980670","detectorId":"cv2.FaceDetectorYN","detectorVersion":"opencv-zoo-yunet-2023mar-pnp-v1","editableMaskCoverageRatio":0.006989640554096011,"editableMaskNonzeroPixelCount":7492,"faceBboxIntersectsEditableMask":true,"faceBboxMaskOverlapAreaPx":3388,"faceBboxMaskOverlapRatio":1.0395419093114588,"faceCenter":{"x":531.6867733001709,"y":580.676628112793},"faceCenterInsideEditableMask":true,"faceCount":1,"failureReasons":[],"imageHeight":1264,"imageSha256":"32c701012e40040772c69bff102719c5d48c9c046bad442f68f1bc520c5bc507","imageWidth":848,"interocularDistancePx":5.92799575581323,"landmarks":[{"x":517.3872680664062,"y":571.6520385742188},{"x":523.2520141601562,"y":572.5156860351562},{"x":512.272705078125,"y":585.1289672851562},{"x":519.70458984375,"y":598.2861938476562},{"x":523.7939453125,"y":599.8984985351562}],"maskHeight":1264,"maskSha256":"6cc71f8088d4bca0f9271255830ccb92f50aaeb77a7c469d635afb6136d4acda","maskWidth":848,"measurementConfigSha256":"8f5678ec01f923ecc6c96ad470cc5583106f73bb8bd7181ba6f928018b6c7a9e","measurementSha256":"82ed46ebb24d2443f1b396168140401404d3ee7fa9fc0edf57f5af0ee348eb73","pitchDeg":-141.7041979219793,"qualityTier":"HIGH","rollDeg":27.606772256570125,"schemaVersion":"1.0","selectedFaceConfidence":0.85426926612854,"selectedFaceIndex":0,"status":"VALID","yawDeg":79.361664677042}